Uid,Title,Author,Abstract,Title_CN,Abstract_CN,Link,Meeting,Complete,Locked,Select1,Select2
1845,Fixing Knockout Tournaments With Seeds.,"Pasin Manurangsi, Warut Suksompong","Knockout tournaments constitute a popular format for organizing sports competitions. While prior results have shown that it is often possible to manipulate a knockout tournament by fixing the bracket, these results ignore the prevalent aspect of player seeds, which can significantly constrain the chosen bracket. We show that certain structural conditions that guarantee that a player can win a knockout tournament without seeds are no longer sufficient in light of seed constraints. On the other hand, we prove that when the pairwise match outcomes are generated randomly, all players are still likely to be knockout winners under the same probability threshold with seeds as without seeds. In addition, we investigate the complexity of deciding whether a manipulation is possible when seeds are present.",用种子固定淘汰赛。,淘汰赛构成了组织体育比赛的流行格式。虽然先前的结果表明，通常可以通过固定支架来操纵淘汰赛，但这些结果忽略了玩家种子的普遍方面，这可能会严重限制所选的支架。我们表明，某些确保玩家可以在没有种子的情况下赢得淘汰赛的结构条件不再足够。另一方面，我们证明，随机生成成对匹配结果时，所有玩家仍然可能是与没有种子的种子相同的概率阈值下淘汰赛冠军。此外，我们研究了在存在种子时确定是否可能进行操作的复杂性。,https://arxiv.org/abs/2204.11171,IJCAI,True,False,False,False
1846,Learning Label Initialization for Time-Dependent Harmonic Extension.,Amitoz Azad,"Node classification on graphs can be formulated as the Dirichlet problem on graphs where the signal is given at the labeled nodes, and the harmonic extension is done on the unlabeled nodes. This paper considers a time-dependent version of the Dirichlet problem on graphs and shows how to improve its solution by learning the proper initialization vector on the unlabeled nodes. Further, we show that the improved solution is at par with state-of-the-art methods used for node classification. Finally, we conclude this paper by discussing the importance of parameter t, pros, and future directions.",学习标签初始化，用于时间相关的谐波扩展。,图上的节点分类可以作为图表上的dirichlet问题进行表述，在该图上给出了标记的节点处的信号，并且在未标记的节点上进行了谐波扩展。本文考虑了图形上的Dirichlet问题的时间相关版本，并通过学习未标记的节点上的适当初始化向量来改善其解决方案。此外，我们表明改进的解决方案与用于节点分类的最新方法相提并论。最后，我们通过讨论参数t，专业和未来方向的重要性来结束本文。,https://arxiv.org/abs/2205.01358,IJCAI,True,False,False,False
1847,RMGN: A Regional Mask Guided Network for Parser-free Virtual Try-on.,"Chao Lin, Zhao Li, Sheng Zhou, Shichang Hu, Jialun Zhang, Linhao Luo, Jiarun Zhang, Longtao Huang, Yuan He","Virtual try-on(VTON) aims at fitting target clothes to reference person images, which is widely adopted in e-commerce.Existing VTON approaches can be narrowly categorized into Parser-Based(PB) and Parser-Free(PF) by whether relying on the parser information to mask the persons' clothes and synthesize try-on images. Although abandoning parser information has improved the applicability of PF methods, the ability of detail synthesizing has also been sacrificed. As a result, the distraction from original cloth may persistin synthesized images, especially in complicated postures and high resolution applications. To address the aforementioned issue, we propose a novel PF method named Regional Mask Guided Network(RMGN). More specifically, a regional mask is proposed to explicitly fuse the features of target clothes and reference persons so that the persisted distraction can be eliminated. A posture awareness loss and a multi-level feature extractor are further proposed to handle the complicated postures and synthesize high resolution images. Extensive experiments demonstrate that our proposed RMGN outperforms both state-of-the-art PB and PF methods.Ablation studies further verify the effectiveness ofmodules in RMGN.",RMGN：用于无解析器虚拟试验的区域蒙版指导网络。,虚拟试验（VTON）旨在将目标服装拟合到参考人员图像，这在电子商务中广泛采用。使用VTON方法可以通过是否依赖于基于Parser（PB）和Parser-Free（PF）将VTON方法狭窄地分类为在解析器的信息上，掩盖了人员的衣服并合成尝试图像。尽管放弃的解析器信息改善了PF方法的适用性，但细节合成的能力也已被牺牲。结果，原始布的分散注意力可能会持续合成图像，尤其是在复杂的姿势和高分辨率应用中。为了解决上述问题，我们提出了一种名为“区域掩码指导网络（RMGN）”的新型PF方法。更具体地说，提出了区域口罩，以明确融合目标衣服和参考人员的特征，以便可以消除持续的干扰。进一步提出了姿势意识丧失和多级特征提取器，以处理复杂的姿势并合成高分辨率图像。广泛的实验表明，我们提出的RMGN胜过最新的PB和PF方法。ABLITATION研究进一步验证了Modules在RMGN中的有效性。,https://arxiv.org/abs/2204.11258,IJCAI,True,False,False,False
1848,Bounded Memory Adversarial Bandits with Composite Anonymous Delayed Feedback.,"Zongqi Wan, Xiaoming Sun, Jialin Zhang","We study the adversarial bandit problem with composite anonymous delayed feedback. In this setting, losses of an action are split into $d$ components, spreading over consecutive rounds after the action is chosen. And in each round, the algorithm observes the aggregation of losses that come from the latest $d$ rounds. Previous works focus on oblivious adversarial setting, while we investigate the harder non-oblivious setting. We show non-oblivious setting incurs $\Omega(T)$ pseudo regret even when the loss sequence is bounded memory. However, we propose a wrapper algorithm which enjoys $o(T)$ policy regret on many adversarial bandit problems with the assumption that the loss sequence is bounded memory. Especially, for $K$-armed bandit and bandit convex optimization, we have $\mathcal{O}(T^{2/3})$ policy regret bound. We also prove a matching lower bound for $K$-armed bandit. Our lower bound works even when the loss sequence is oblivious but the delay is non-oblivious. It answers the open problem proposed in \cite{wang2021adaptive}, showing that non-oblivious delay is enough to incur $\tilde{\Omega}(T^{2/3})$ regret.",带有复合匿名延迟反馈的有界内存对抗匪。,我们研究了对抗匿名延迟反馈的对抗性匪徒问题。在这种情况下，操作的损失分为$ d $组件，在选择动作后连续一轮散布。在每回合中，该算法都观察到来自最新$ d $回合的损失的汇总。以前的作品着重于遗忘的对抗环境，同时我们研究了更艰难的非欺骗环境。我们展示的不掩饰设置会引起$ \ omega（t）$ pseudo遗憾，即使损失序列是有限的内存也是如此。但是，我们提出了一种包装算法，该算法在许多对抗性强盗问题上都享受$ o（t）$ policy遗憾，假设损失顺序是有限的记忆。特别是，对于$ k $ armed的强盗和强盗凸优化，我们有$ \ mathcal {o}（t^{2/3}）$ policy policy selford绑定。我们还证明了$ k $武装的强盗的匹配下限。即使损失序列是遗忘的，我们的下限也起作用，但延迟是非掩饰的。它回答了\ cite {wang2021Adaptive}中提出的开放问题，表明非欺骗性延迟足以产生$ \ tilde {\ omega}（\ omega}（t^{2/3}）$遗憾。,https://arxiv.org/abs/2204.12764,IJCAI,True,False,False,False
1849,Network Creation with Homophilic Agents.,"Martin Bullinger, Pascal Lenzner, Anna Melnichenko","Network Creation Games are an important framework for understanding the formation of real-world networks. These games usually assume a set of indistinguishable agents strategically buying edges at a uniform price leading to a network among them. However, in real life, agents are heterogeneous and their relationships often display a bias towards similar agents, say of the same ethnic group. This homophilic behavior on the agent level can then lead to the emergent global phenomenon of social segregation. We initiate the study of Network Creation Games with multiple types of homophilic agents and non-uniform edge cost. Specifically, we introduce and compare two models, focusing on the perception of same-type and different-type neighboring agents, respectively. Despite their different initial conditions, both our theoretical and experimental analysis show that the resulting stable networks are almost identical in the two models, indicating a robust structure of social networks under homophily. Moreover, we investigate the segregation strength of the formed networks and thereby offer new insights on understanding segregation.",与同粒子代理的网络创建。,网络创建游戏是理解现实世界网络形成的重要框架。这些游戏通常会以一套不可区分的代理商在战略上以统一的价格购买边缘，从而导致网络中的网络。但是，在现实生活中，代理人是异质的，他们的关系经常对相似的代理人表现出偏见，例如同一族裔。然后，这种代理水平上的这种同质行为可以导致社会种族隔离的新兴全球现象。我们启动具有多种类型的同粒子代理和不均匀边缘成本的网络创建游戏的研究。具体而言，我们介绍和比较了两个模型，分别着重于对相同型和不同型相邻代理的感知。尽管它们的初始条件不同，但我们的理论和实验分析都表明，在这两个模型中，所得稳定的网络几乎相同，表明同质下的社交网络结构可靠。此外，我们研究了形成的网络的隔离强度，从而为理解种族隔离提供了新的见解。,https://arxiv.org/abs/2204.13757,IJCAI,True,False,False,False
1850,"Placing Green Bridges Optimally, with Habitats Inducing Cycles.","Maike Herkenrath, Till Fluschnik, Francesco Grothe, Leon Kellerhals","Choosing the placement of wildlife crossings (i.e., green bridges) to reconnect animal species' fragmented habitats is among the 17 goals towards sustainable development by the UN. We consider the following established model: Given a graph whose vertices represent the fragmented habitat areas and whose weighted edges represent possible green bridge locations, as well as the habitable vertex set for each species, find the cheapest set of edges such that each species' habitat is connected. We study this problem from a theoretical (algorithms and complexity) and an experimental perspective, while focusing on the case where habitats induce cycles. We prove that the NP-hardness persists in this case even if the graph structure is restricted. If the habitats additionally induce faces in plane graphs however, the problem becomes efficiently solvable. In our empirical evaluation we compare this algorithm as well as ILP formulations for more general variants and an approximation algorithm with another. Our evaluation underlines that each specialization is beneficial in terms of running time, whereas the approximation provides highly competitive solutions in practice.",最佳地放置绿色桥梁，并具有诱导周期的栖息地。,选择野生动植物过境点（即绿桥）重新连接动物物种零散的栖息地是联合国可持续发展的17个目标之一。我们考虑以下既定模型：给定的图表，其顶点代表零散的栖息地区域，其加权边缘代表了可能的绿色桥梁位置以及每个物种的可居住顶点，找到了最便宜的边缘，以使每个物种的栖息地都可以已连接。我们从理论（算法和复杂性）和实验性观点研究了这个问题，同时着重于栖息地诱导周期的情况。我们证明，即使图形结构受到限制，在这种情况下，NP硬度仍然存在。但是，如果栖息地还在平面图中诱导面孔，则该问题将有效地解决。在我们的经验评估中，我们比较了该算法以及ILP公式的更通用的变体和近似算法与另一种算法。我们的评估强调，每个专业化在运行时间方面都是有益的，而近似值在实践中提供了高度竞争的解决方案。,https://arxiv.org/abs/2201.12273,IJCAI,True,False,False,False
1851,Ridgeless Regression with Random Features.,"Jian Li, Yong Liu, Yingying Zhang","Recent theoretical studies illustrated that kernel ridgeless regression can guarantee good generalization ability without an explicit regularization. In this paper, we investigate the statistical properties of ridgeless regression with random features and stochastic gradient descent. We explore the effect of factors in the stochastic gradient and random features, respectively. Specifically, random features error exhibits the double-descent curve. Motivated by the theoretical findings, we propose a tunable kernel algorithm that optimizes the spectral density of kernel during training. Our work bridges the interpolation theory and practical algorithm.",具有随机特征的无骑线回归。,最近的理论研究表明，内核无脊回归可以保证良好的概括能力而无需明确的正则化。在本文中，我们研究了具有随机特征和随机梯度下降的无乘车回归的统计特性。我们分别探讨了随机梯度和随机特征中因素的影响。具体而言，随机特征误差表现出双重曲线。在理论发现的激励下，我们提出了一种可调核算法，该算法优化了训练过程中内核的光谱密度。我们的工作桥接了插值理论和实用算法。,https://arxiv.org/abs/2205.00477,IJCAI,True,False,False,False
1852,Robustness Guarantees for Credal Bayesian Networks via Constraint Relaxation over Probabilistic Circuits.,"Hjalmar Wijk, Benjie Wang, Marta Kwiatkowska","In many domains, worst-case guarantees on the performance (e.g., prediction accuracy) of a decision function subject to distributional shifts and uncertainty about the environment are crucial. In this work we develop a method to quantify the robustness of decision functions with respect to credal Bayesian networks, formal parametric models of the environment where uncertainty is expressed through credal sets on the parameters. In particular, we address the maximum marginal probability (MARmax) problem, that is, determining the greatest probability of an event (such as misclassification) obtainable for parameters in the credal set. We develop a method to faithfully transfer the problem into a constrained optimization problem on a probabilistic circuit. By performing a simple constraint relaxation, we show how to obtain a guaranteed upper bound on MARmax in linear time in the size of the circuit. We further theoretically characterize this constraint relaxation in terms of the original Bayesian network structure, which yields insight into the tightness of the bound. We implement the method and provide experimental evidence that the upper bound is often near tight and demonstrates improved scalability compared to other methods.",通过对概率电路的限制放松，稳健性可以保证信用贝叶斯网络。,在许多领域中，最坏情况可以保证受到分布转移和环境不确定性的决策功能的性能（例如预测准确性）至关重要。在这项工作中，我们开发了一种方法来量化对信用贝叶斯网络的决策函数的鲁棒性，即环境的形式参数模型，在该模型中，通过参数的信用集表示不确定性。特别是，我们解决了最大边缘概率（MARMAX）问题，即确定可用于信用集中参数可获得的事件的最大概率（例如错误分类）。我们开发了一种将问题忠实地转移到概率电路上的约束优化问题中的方法。通过执行简单的约束松弛，我们展示了如何在电路尺寸的线性时间内获得保证的上限。我们从理论上进一步描述了这种约束放松，从原始的贝叶斯网络结构角度来看，这可以深入了解界限的紧密度。我们实施了该方法，并提供了实验证据，表明上限通常接近紧密，并且与其他方法相比证明了可伸缩性的提高。,https://arxiv.org/abs/2205.05793,IJCAI,True,False,False,False
1853,Insight into Voting Problem Complexity Using Randomized Classes.,"Zack Fitzsimmons, Edith Hemaspaandra","The first step in classifying the complexity of an NP problem is typically showing the problem in P or NP-complete. This has been a successful first step for many problems, including voting problems. However, in this paper we show that this may not always be the best first step. We consider the problem of constructive control by replacing voters (CCRV) introduced by Loreggia et al. (2015) for the scoring rule First-Last, which is defined by $\langle 1, 0, \dots, 0, -1\rangle$. We show that this problem is equivalent to Exact Perfect Bipartite Matching, and so CCRV for First-Last can be determined in random polynomial time. So on the one hand, if CCRV for First-Last is NP-complete then RP = NP, which is extremely unlikely. On the other hand, showing that CCRV for First-Last is in P would also show that Exact Perfect Bipartite Matching is in P, which would solve a well-studied 40-year-old open problem.   By considering RP as an option we also gain insight into the complexity of CCRV for 2-Approval, ultimately showing it in P, which settles the complexity of the sole open problem in the comprehensive table from Erd\'{e}lyi et al. (2021).",使用随机类洞察投票问题复杂性。,对NP问题的复杂性进行分类的第一步通常是在P或NP完成中显示该问题。对于许多问题，包括投票问题，这是成功的第一步。但是，在本文中，我们表明这可能并不总是是最好的第一步。我们考虑了Loreggia等人提出的替换选民（CCRV）来考虑建设性控制的问题。（2015年）对于得分规则，由$ \ langle 1，0，\ dots，0，-1 \ rangle $定义。我们表明，这个问题等同于精确的完美两分匹配，因此可以在随机多项式时间内确定第一last的CCRV。因此，一方面，如果用于第一last的CCRV是NP完整的，则RP = NP，这是极不可能的。另一方面，表明第一持久的CCRV在P中也将表明P Perfect Perfect piptite匹配是在P中，这将解决一个经过良好研究的40年历史的开放问题。通过将RP作为一种选择，我们还可以深入了解2批准的CCRV的复杂性，最终在P中显示了CCRV的复杂性，该ccrv在p \'{e} lyi等人的综合表中解决了唯一开放问题的复杂性。（2021）。,https://arxiv.org/abs/2204.12856,IJCAI,True,False,False,False
1854,Real-Time BDI Agents: A Model and Its Implementation.,"Andrea Traldi, Francesco Bruschetti, Marco Robol, Marco Roveri, Paolo Giorgini","The BDI model proved to be effective for developing applications requiring high-levels of autonomy and to deal with the complexity and unpredictability of real-world scenarios. The model, however, has significant limitations in reacting and handling contingencies within the given real-time constraints. Without an explicit representation of time, existing real-time BDI implementations overlook the temporal implications during the agent's decision process that may result in delays or unresponsiveness of the system when it gets overloaded. In this paper, we redefine the BDI agent control loop inspired by well established algorithms for real-time systems to ensure a proper reaction of agents and their effective application in typical real-time domains. Our model proposes an effective real-time management of goals, plans, and actions with respect to time constraints and resources availability. We propose an implementation of the model for a resource-collection video-game and we validate the approach against a set of significant scenarios.",实时BDI代理：模型及其实施。,事实证明，BDI模型对于开发需要高级自治的应用程序有效，并应对现实情况的复杂性和不可预测性。但是，该模型在给定实时限制内的反应和处理意外事件方面具有重大局限性。如果没有明确表示时间，现有的实时BDI实现忽略了代理决策过程中的时间含义，这些含义可能会导致系统过载时的延迟或反应。在本文中，我们重新定义了BDI代理控制环的灵感，灵感来自实时系统的良好算法，以确保代理的适当反应及其在典型的实时域中的有效应用。我们的模型提出了有关时间限制和资源可用性的有效实时管理。我们建议对资源收集视频游戏的模型实施，并根据一组重要场景验证该方法。,https://arxiv.org/abs/2205.00979,IJCAI,True,False,False,False
1855,Approval with Runoff.,"Théo Delemazure, Jérôme Lang, Jean-François Laslier, Remzi Sanver","We define a family of runoff rules that work as follows: voters cast approval ballots over candidates; two finalists are selected; and the winner is decided by majority. With approval-type ballots, there are various ways to select the finalists. We leverage known approval-based committee rules and study the obtained runoff rules from an axiomatic point of view. Then we analyze the outcome of these rules on single-peaked profiles, and on real data.",批准径流。,我们定义了一系列的径流规则，如下所示：选民对候选人进行批准选票；选出两名决赛选手；获胜者由多数派决定。有了批准式选票，有多种选择决赛选手的方法。我们利用已知的基于批准的委员会规则，并从公理角度研究获得的径流规则。然后，我们分析了这些规则在单峰配置文件和实际数据上的结果。,https://arxiv.org/abs/2203.02343,IJCAI,True,False,False,False
1856,Multi-Armed Bandit Problem with Temporally-Partitioned Rewards: When Partial Feedback Counts.,"Giulia Romano, Andrea Agostini, Francesco Trovò, Nicola Gatti, Marcello Restelli","There is a rising interest in industrial online applications where data becomes available sequentially. Inspired by the recommendation of playlists to users where their preferences can be collected during the listening of the entire playlist, we study a novel bandit setting, namely Multi-Armed Bandit with Temporally-Partitioned Rewards (TP-MAB), in which the stochastic reward associated with the pull of an arm is partitioned over a finite number of consecutive rounds following the pull. This setting, unexplored so far to the best of our knowledge, is a natural extension of delayed-feedback bandits to the case in which rewards may be dilated over a finite-time span after the pull instead of being fully disclosed in a single, potentially delayed round. We provide two algorithms to address TP-MAB problems, namely, TP-UCB-FR and TP-UCB-EW, which exploit the partial information disclosed by the reward collected over time. We show that our algorithms provide better asymptotical regret upper bounds than delayed-feedback bandit algorithms when a property characterizing a broad set of reward structures of practical interest, namely alpha-smoothness, holds. We also empirically evaluate their performance across a wide range of settings, both synthetically generated and from a real-world media recommendation problem.",多臂匪徒问题带有时间分配的奖励：当部分反馈计数时。,对工业在线应用程序的兴趣不大，其中数据依次可用。受播放列表的推荐启发给用户，在整个播放列表的聆听期间可以收集他们的偏好，我们研究了一个新颖的强盗设置，即带有时间分配的奖励（TP-MAB）的多军匪徒，在其中，随机奖励与手臂的拉力相关联，在拉动之后，将连续数量有限的连续回合分开。到目前为止，这种设置尚未探索到我们所知，这是对延迟反馈土匪的自然延伸，在拉力之后可以在有限的时间内扩张奖励，而不是在单个，潜在的，潜在的，可能完全披露延迟回合。我们提供两种算法来解决TP-MAB问题，即TP-UCB-FR和TP-UCB-EW，这些算法利用了随着时间的推移收集的奖励所披露的部分信息。我们表明，当一个属性表征了一系列具有实际兴趣的奖励结构（即Alpha-Smoothness）时，我们的算法比延迟反馈的强盗算法提供了更好的渐近遗憾上限。我们还从合成生成和现实世界中的媒体推荐问题中进行了经验评估它们在广泛的环境中的性能。,https://arxiv.org/abs/2206.00586,IJCAI,True,False,False,False
1857,Limits and Possibilities of Forgetting in Abstract Argumentation,"R Baumann, M Berthold",nan,在抽象论证中忘记忘记的限制和可能性, ,https://scholar.google.com.hk,IJCAI,False,True,False,False
