Uid,Title,Author,Abstract,Title_CN,Abstract_CN,Link,Meeting,Complete,Locked,Select1,Select2
1764,Optimal Anonymous Independent Reward Scheme Design.,"Mengjing Chen, Pingzhong Tang, Zihe Wang, Shenke Xiao, Xiwang Yang","We consider designing reward schemes that incentivize agents to create high-quality content (e.g., videos, images, text, ideas). The problem is at the center of a real-world application where the goal is to optimize the overall quality of generated content on user-generated content platforms. We focus on anonymous independent reward schemes (AIRS) that only take the quality of an agent's content as input. We prove the general problem is NP-hard. If the cost function is convex, we show the optimal AIRS can be formulated as a convex optimization problem and propose an efficient algorithm to solve it. Next, we explore the optimal linear reward scheme and prove it has a 1/2-approximation ratio, and the ratio is tight. Lastly, we show the proportional scheme can be arbitrarily bad compared to AIRS.",最佳匿名独立奖励方案设计。,我们考虑设计奖励方案，以激励代理创建高质量内容（例如，视频，图像，文本，想法）。问题是现实世界应用程序的中心，其目标是优化用户生成的内容平台上生成的内容的整体质量。我们专注于匿名独立奖励方案（AIRS），这些计划仅将代理商的内容作为输入。我们证明了一般问题是NP-HARD。如果成本函数是凸的，我们表明最佳空气可以作为凸优化问题进行配制，并提出有效的算法来解决它。接下来，我们探索最佳线性奖励方案，并证明其具有1/2的附属能力比，并且比率很紧。最后，我们表明比例方案与AIRS相比可能是任意不良的。,https://arxiv.org/abs/2205.00192,IJCAI,True,False,False,False
1765,Semi-Supervised Imitation Learning of Team Policies from Suboptimal Demonstrations.,"Sangwon Seo, Vaibhav V. Unhelkar","We present Bayesian Team Imitation Learner (BTIL), an imitation learning algorithm to model behavior of teams performing sequential tasks in Markovian domains. In contrast to existing multi-agent imitation learning techniques, BTIL explicitly models and infers the time-varying mental states of team members, thereby enabling learning of decentralized team policies from demonstrations of suboptimal teamwork. Further, to allow for sample- and label-efficient policy learning from small datasets, BTIL employs a Bayesian perspective and is capable of learning from semi-supervised demonstrations. We demonstrate and benchmark the performance of BTIL on synthetic multi-agent tasks as well as a novel dataset of human-agent teamwork. Our experiments show that BTIL can successfully learn team policies from demonstrations despite the influence of team members' (time-varying and potentially misaligned) mental states on their behavior.",从次优示威中对团队政策的半监督模仿学习。,我们提出了贝叶斯团队模仿学习者（BTIL），这是一种模仿学习算法，以模拟马尔可夫域中执行顺序任务的团队的行为。与现有的多机构模仿学习技术相反，BTIL明确模型并渗透了团队成员的时间变化的心理状态，从而从次优的团队合作的演示中实现了分散的团队政策的学习。此外，为了允许从小型数据集中进行样本和标签有效的政策学习，Btil采用了贝叶斯的角度，并且能够从半监督的示范中学习。我们证明并基准了BTIL在合成多代理任务以及人类代理团队工作的新型数据集上的性能。我们的实验表明，尽管团队成员（随时间变化且可能未对准）精神状态对其行为的影响，BTIL可以成功地从示威中学习团队政策。,https://arxiv.org/abs/2205.02959,IJCAI,True,False,False,False
1766,Adaptive Information Belief Space Planning.,"Moran Barenboim, Vadim Indelman","Reasoning about uncertainty is vital in many real-life autonomous systems. However, current state-of-the-art planning algorithms cannot either reason about uncertainty explicitly, or do so with a high computational burden. Here, we focus on making informed decisions efficiently, using reward functions that explicitly deal with uncertainty. We formulate an approximation, namely an abstract observation model, that uses an aggregation scheme to alleviate computational costs. We derive bounds on the expected information-theoretic reward function and, as a consequence, on the value function. We then propose a method to refine aggregation to achieve identical action selection with a fraction of the computational time.",自适应信息信念空间规划。,关于不确定性的推理在许多现实生活中的自治系统中至关重要。但是，当前的最新计划算法不能明确地考虑不确定性的原因，也不能承担较高的计算负担。在这里，我们专注于有效地采用明确处理不确定性的奖励功能，以有效地做出明智的决策。我们制定了一个近似值，即一种抽象观察模型，该模型使用聚合方案来减轻计算成本。我们在预期的信息理论奖励函数上得出界限，并因此在价值函数上得出了界限。然后，我们提出了一种方法来完善聚合以在计算时间的一部分中实现相同的动作选择。,https://arxiv.org/abs/2201.05673,IJCAI,True,False,False,False
1767,Iterative Geometry-Aware Cross Guidance Network for Stereo Image Inpainting.,"Ang Li, Shanshan Zhao, Qingjie Zhang, Qiuhong Ke","Currently, single image inpainting has achieved promising results based on deep convolutional neural networks. However, inpainting on stereo images with missing regions has not been explored thoroughly, which is also a significant but different problem. One crucial requirement for stereo image inpainting is stereo consistency. To achieve it, we propose an Iterative Geometry-Aware Cross Guidance Network (IGGNet). The IGGNet contains two key ingredients, i.e., a Geometry-Aware Attention (GAA) module and an Iterative Cross Guidance (ICG) strategy. The GAA module relies on the epipolar geometry cues and learns the geometry-aware guidance from one view to another, which is beneficial to make the corresponding regions in two views consistent. However, learning guidance from co-existing missing regions is challenging. To address this issue, the ICG strategy is proposed, which can alternately narrow down the missing regions of the two views in an iterative manner. Experimental results demonstrate that our proposed network outperforms the latest stereo image inpainting model and state-of-the-art single image inpainting models.",迭代性几何形状感知的跨指导网络，用于插入立体声图像。,目前，基于深层卷积神经网络的单图像介入已取得了令人鼓舞的结果。但是，尚未对具有缺失区域的立体声图像进行介绍，这也是一个重大但不同的问题。立体声图像填充的一个关键要求是立体声一致性。为了实现这一目标，我们提出了一个迭代的几何学跨指导网络（IGGNET）。IGGNET包含两种关键成分，即几何学意识（GAA）模块和迭代交叉指导（ICG）策略。GAA模块依赖于外两极的几何提示，并从一种视图到另一种视图学习了几何学意识的指导，这有助于使两个视图中的相应区域保持一致。但是，从共存的缺失地区学习指导是具有挑战性的。为了解决这个问题，提出了ICG策略，可以以迭代方式交替缩小两个观点的缺失区域。实验结果表明，我们提出的网络优于最新的立体声图像介入模型和最先进的单图像介绍模型。,https://arxiv.org/abs/2205.03825,IJCAI,True,False,False,False
1768,Efficient and Accurate Conversion of Spiking Neural Network with Burst Spikes.,"Yang Li, Yi Zeng","Spiking neural network (SNN), as a brain-inspired energy-efficient neural network, has attracted the interest of researchers. While the training of spiking neural networks is still an open problem. One effective way is to map the weight of trained ANN to SNN to achieve high reasoning ability. However, the converted spiking neural network often suffers from performance degradation and a considerable time delay. To speed up the inference process and obtain higher accuracy, we theoretically analyze the errors in the conversion process from three perspectives: the differences between IF and ReLU, time dimension, and pooling operation. We propose a neuron model for releasing burst spikes, a cheap but highly efficient method to solve residual information. In addition, Lateral Inhibition Pooling (LIPooling) is proposed to solve the inaccuracy problem caused by MaxPooling in the conversion process. Experimental results on CIFAR and ImageNet demonstrate that our algorithm is efficient and accurate. For example, our method can ensure nearly lossless conversion of SNN and only use about 1/10 (less than 100) simulation time under 0.693$\times$ energy consumption of the typical method. Our code is available at https://github.com/Brain-Inspired-Cognitive-Engine/Conversion_Burst.",具有突发尖峰的尖峰神经网络的有效而准确的转换。,尖峰神经网络（SNN）是一种受脑启发的节能神经网络，吸引了研究人员的兴趣。虽然培训尖峰神经网络仍然是一个空旷的问题。一种有效的方法是将训练有素的ANN的重量映射到SNN，以获得高推理能力。但是，转换后的尖峰神经网络通常会遭受性能降解和相当大的时间延迟。为了加快推理过程并获得更高的准确性，我们从三个角度从理论上分析了转换过程中的错误：IF和RELU之间的差异，时间维度和合并操作。我们提出了一个用于释放爆发尖峰的神经元模型，这是一种廉价但高效的方法来解决残差信息。此外，提出了横向抑制池（脂肪）来解决转换过程中最大化引起的不准确问题。CIFAR和Imagenet的实验结果表明，我们的算法是有效而准确的。例如，我们的方法可以确保SNN的几乎无损转换，并且仅在0.693 $ \ times $ $ 1/10（少于100）的模拟时间下使用典型方法的能源消耗。我们的代码可在https://github.com/brain-inspired-cognitive-engine/conversion_burst上找到。,https://arxiv.org/abs/2204.13271,IJCAI,True,False,False,False
1769,The Power of Media Agencies in Ad Auctions: Improving Utility through Coordinated Bidding.,"Giulia Romano, Matteo Castiglioni, Alberto Marchesi, Nicola Gatti","The increasing competition in digital advertising induced a proliferation of media agencies playing the role of intermediaries between advertisers and platforms selling ad slots. When a group of competing advertisers is managed by a common agency, many forms of collusion, such as bid rigging, can be implemented by coordinating bidding strategies, dramatically increasing advertisers' value. We study the problem of finding bids and monetary transfers maximizing the utility of a group of colluders, under GSP and VCG mechanisms. First, we introduce an abstract bid optimization problem -- called weighted utility problem (WUP) -- , which is useful in proving our results. We show that the utilities of bidding strategies are related to the length of paths in a directed acyclic weighted graph, whose structure and weights depend on the mechanism under study. This allows us to solve WUP in polynomial time by finding a shortest path of the graph. Next, we switch to our original problem, focusing on two settings that differ for the incentives they allow for. Incentive constraints ensure that colluders do not leave the agency, and they can be enforced by implementing monetary transfers between the agency and the advertisers. In particular, we study the arbitrary transfers setting, where any kind of monetary transfer to and from the advertisers is allowed, and the more realistic limited liability setting, in which no advertiser can be paid by the agency. In the former, we cast the problem as a WUP instance and solve it by our graph-based algorithm, while, in the latter, we formulate it as a linear program with exponentially-many variables efficiently solvable by applying the ellipsoid algorithm to its dual. This requires to solve a suitable separation problem in polynomial time, which can be done by reducing it to a WUP instance.",媒体机构在广告拍卖中的权力：通过协调的招标来改善公用事业。,数字广告中日益增长的竞争引起了媒体机构在广告商和销售广告插槽的平台之间扮演中介机构的角色的扩散。当一组竞争广告商由普通代理商管理时，可以通过协调投标策略来实施许多形式的勾结，例如投标索具，从而大大提高广告商的价值。我们研究了在GSP和VCG机制下发现竞标和货币转移最大化的货币转移的问题。首先，我们引入了一个抽象的投标优化问题 - 称为加权实用程序问题（WUP），这对于证明我们的结果很有用。我们表明，投标策略的实用程序与定向无环的图形中的路径长度有关，其结构和权重取决于所研究的机制。这使我们能够通过找到图形的最短路径来解决多项式时间。接下来，我们切换到我们的原始问题，重点关注两个设置，这些设置因其允许的激励措施而有所不同。激励限制确保颜色不会离开代理机构，并且可以通过在代理商和广告商之间实施货币转让来执行它们。特别是，我们研究了任意转移设置，允许往返广告商的任何类型的货币转移，以及更现实的有限责任设置，该机构无法支付广告商。在前者中，我们将问题作为WUP实例施加，并通过基于图的算法解决问题，而在后者中，我们将其作为线性程序制定，并通过将椭圆形算法应用于其双重方向，可以有效地求解呈指数式的变量。。这需要在多项式时间内解决合适的分离问题，这可以通过将其简化为WUP实例来完成。,https://arxiv.org/abs/2204.13772,IJCAI,True,False,False,False
1770,Online Approval Committee Elections.,"Virginie Do, Matthieu Hervouin, Jérôme Lang, Piotr Skowron","Assume $k$ candidates need to be selected. The candidates appear over time. Each time one appears, it must be immediately selected or rejected -- a decision that is made by a group of individuals through voting. Assume the voters use approval ballots, i.e., for each candidate they only specify whether they consider it acceptable or not. This setting can be seen as a voting variant of choosing $k$ secretaries. Our contribution is twofold. (1) We assess to what extent the committees that are computed online can proportionally represent the voters. (2) If a prior probability over candidate approvals is available, we show how to compute committees with maximal expected score.",在线批准委员会选举。,假设需要选择$ K $候选人。候选人会随着时间的流逝而出现。每次出现时，都必须立即选择或拒绝它 - 一组个人通过投票做出的决定。假设选民使用批准选票，即，对于每个候选人，他们只指定他们是否认为可以接受。该设置可以看作是选择$ K $秘书的投票变体。我们的贡献是双重的。（1）我们评估在线计算的委员会在多大程度上可以按比例地代表选民。（2）如果获得候选人批准的先验概率，我们将展示如何以最大预期得分计算委员会。,https://arxiv.org/abs/2202.06830,IJCAI,True,False,False,False
1771,Runtime Analysis of Single- and Multi-Objective Evolutionary Algorithms for Chance Constrained Optimization Problems with Normally Distributed Random Variables.,"Frank Neumann, Carsten Witt","Chance constrained optimization problems allow to model problems where constraints involving stochastic components should only be violated with a small probability. Evolutionary algorithms have recently been applied to this scenario and shown to achieve high quality results. With this paper, we contribute to the theoretical understanding of evolutionary algorithms for chance constrained optimization. We study the scenario of stochastic components that are independent and Normally distributed. By generalizing results for the class of linear functions to the sum of transformed linear functions, we show that the (1+1)~EA can optimize the chance constrained setting without additional constraints in time O(n log n). However, we show that imposing an additional uniform constraint already leads to local optima for very restricted scenarios and an exponential optimization time for the (1+1)~EA. We therefore propose a multi-objective formulation of the problem which trades off the expected cost and its variance. We show that multi-objective evolutionary algorithms are highly effective when using this formulation and obtain a set of solutions that contains an optimal solution for any possible confidence level imposed on the constraint. Furthermore, we show that this approach can also be used to compute a set of optimal solutions for the chance constrained minimum spanning tree problem.",与正态分布随机变量的机会约束优化问题的单目标进化算法的运行时分析。,机会受到限制的优化问题允许建模问题，其中涉及随机组件的约束仅应以较小的概率侵犯。进化算法最近已应用于此情况，并证明可以实现高质量的结果。在本文中，我们有助于对进化算法的理论理解，以进行偶然的优化。我们研究独立且正态分布的随机组件的场景。通过将线性函数类的结果概括为转换的线性函数的总和，我们表明（1+1）〜EA可以优化机会约束设置，而无需时间O（n log n）。但是，我们表明，对非常有限的场景和（1+1）〜EA的指数优化时间已经导致局部最佳限制。因此，我们提出了问题的多目标公式，以摆脱预期成本及其差异。我们表明，在使用此公式时，多目标进化算法是非常有效的，并获得一组解决方案，该解决方案包含最佳解决方案，以适用于施加在约束上的任何可能的置信度。此外，我们证明这种方法还可以用于计算一组最佳解决方案，以限制最小跨越树问题。,https://arxiv.org/abs/2109.05799,IJCAI,True,False,False,False
1772,Parameterized Algorithms for Kidney Exchange.,"Arnab Maiti, Palash Dey","In kidney exchange programs, multiple patient-donor pairs each of whom are otherwise incompatible, exchange their donors to receive compatible kidneys. The Kidney Exchange problem is typically modelled as a directed graph where every vertex is either an altruistic donor or a pair of patient and donor; directed edges are added from a donor to its compatible patients. The computational task is to find if there exists a collection of disjoint cycles and paths starting from altruistic donor vertices of length at most l_c and l_p respectively that covers at least some specific number t of non-altruistic vertices (patients). We study parameterized algorithms for the kidney exchange problem in this paper. Specifically, we design FPT algorithms parameterized by each of the following parameters: (1) the number of patients who receive kidney, (2) treewidth of the input graph + max{l_p, l_c}, and (3) the number of vertex types in the input graph when l_p <= l_c. We also present interesting algorithmic and hardness results on the kernelization complexity of the problem. Finally, we present an approximation algorithm for an important special case of Kidney Exchange.",肾脏交换的参数化算法。,在肾脏交换计划中，多个患者对否则不兼容，将其捐赠者交换以接收兼容的肾脏。肾脏交换问题通常被建模为有向图，每个顶点都是无私的供体或一对患者和捐赠者。从捐赠者添加到兼容患者的方向边缘。计算任务是找出是否存在从最多l_c和l_p的利他主义供体顶点开始的不相交周期和路径的集合，该顶点至少涵盖了至少一些特定数量的t非alltruistic thertices（患者）。我们在本文中研究了肾脏交换问题的参数化算法。具体而言，我们设计了由以下每个参数参数化的fpt算法：（1）接受肾脏的患者数量，（2）输入图 + max {l_p，l_c}的树宽，以及（3）VERTETEX类型的数量在输入图中，当l_p <= l_c时。我们还介绍了有关问题的内核复杂性的有趣算法和硬度结果。最后，我们提出了一种重要的肾脏交换特殊情况的近似算法。,https://arxiv.org/abs/2112.10250,IJCAI,True,False,False,False
1773,Learning First-Order Rules with Differentiable Logic Program Semantics.,"Kun Gao, Katsumi Inoue, Yongzhi Cao, Hanpin Wang","Learning first-order logic programs (LPs) from relational facts which yields intuitive insights into the data is a challenging topic in neuro-symbolic research. We introduce a novel differentiable inductive logic programming (ILP) model, called differentiable first-order rule learner (DFOL), which finds the correct LPs from relational facts by searching for the interpretable matrix representations of LPs. These interpretable matrices are deemed as trainable tensors in neural networks (NNs). The NNs are devised according to the differentiable semantics of LPs. Specifically, we first adopt a novel propositionalization method that transfers facts to NN-readable vector pairs representing interpretation pairs. We replace the immediate consequence operator with NN constraint functions consisting of algebraic operations and a sigmoid-like activation function. We map the symbolic forward-chained format of LPs into NN constraint functions consisting of operations between subsymbolic vector representations of atoms. By applying gradient descent, the trained well parameters of NNs can be decoded into precise symbolic LPs in forward-chained logic format. We demonstrate that DFOL can perform on several standard ILP datasets, knowledge bases, and probabilistic relation facts and outperform several well-known differentiable ILP models. Experimental results indicate that DFOL is a precise, robust, scalable, and computationally cheap differentiable ILP model.",使用可区分的逻辑程序语义学习一阶规则。,从关系事实中学习一阶逻辑程序（LPS），这些事实能够对数据产生直观的见解，这是神经符号研究的一个挑战性主题。我们介绍了一种新型的可区分归纳逻辑编程（ILP）模型，称为一阶规则学习者（DFOL），该模型通过搜索LPS的可解释的矩阵表示来从关系事实中找到正确的LP。这些可解释的矩阵被认为是神经网络（NNS）中的可训练张量。NN是根据LPS的可区分语义设计的。具体而言，我们首先采用了一种新颖的命题方法，该方法将事实转移到代表解释对的NN可读矢量对。我们用NN约束函数代替了直接的后果操作员，该功能由代数操作和类似Sigmoid的激活函数组成。我们将LPS的符号前链格式映射到NN约束函数中，该函数由原子的亚符号矢量表示之间的操作组成。通过应用梯度下降，可以将训练的NN的井参数解码为前链逻辑格式的精确符号LPS。我们证明DFOL可以在几个标准的ILP数据集，知识库和概率关系事实上执行，并且表现优于几个众所周知的可区分ILP模型。实验结果表明，DFOL是一种精确，可靠，可扩展和计算上便宜的ILP模型。,https://arxiv.org/abs/2204.13570,IJCAI,True,False,False,False
