Uid,Title,Author,Abstract,Title_CN,Abstract_CN,Link,Meeting,Complete,Locked,Select1,Select2
1695,Recipe2Vec: Multi-modal Recipe Representation Learning with Graph Neural Networks.,"Yijun Tian, Chuxu Zhang, Zhichun Guo, Yihong Ma, Ronald Metoyer, Nitesh V. Chawla","Learning effective recipe representations is essential in food studies. Unlike what has been developed for image-based recipe retrieval or learning structural text embeddings, the combined effect of multi-modal information (i.e., recipe images, text, and relation data) receives less attention. In this paper, we formalize the problem of multi-modal recipe representation learning to integrate the visual, textual, and relational information into recipe embeddings. In particular, we first present Large-RG, a new recipe graph data with over half a million nodes, making it the largest recipe graph to date. We then propose Recipe2Vec, a novel graph neural network based recipe embedding model to capture multi-modal information. Additionally, we introduce an adversarial attack strategy to ensure stable learning and improve performance. Finally, we design a joint objective function of node classification and adversarial learning to optimize the model. Extensive experiments demonstrate that Recipe2Vec outperforms state-of-the-art baselines on two classic food study tasks, i.e., cuisine category classification and region prediction. Dataset and codes are available at https://github.com/meettyj/Recipe2Vec.",配方2VEC：使用图神经网络的多模式配方表示学习。,学习有效的配方表示在食品研究中至关重要。与基于图像的食谱检索或学习结构文本嵌入的开发的内容不同，多模式信息（即食谱图像，文本和关系数据）的组合效果受到较少的关注。在本文中，我们正式化了多模式配方表示学习的问题，以将视觉，文本和关系信息整合到食谱嵌入中。特别是，我们首先介绍了大型RG，这是一个具有超过半百万节点的新食谱图数据，使其成为迄今为止最大的配方图。然后，我们提出了配方2VEC，这是一种基于图形神经网络的新型食谱嵌入模型，以捕获多模式信息。此外，我们引入了一种对抗性攻击策略，以确保稳定学习并提高绩效。最后，我们设计了节点分类和对抗性学习的联合目标功能，以优化模型。广泛的实验表明，配方2VEC在两项经典食品研究任务（即美食类别分类和区域预测）上的最先进基线优于最先进的基线。数据集和代码可在https://github.com/meettyj/recipe2vec上找到。,https://arxiv.org/abs/2205.12396,IJCAI,True,False,True,False
1696,RAW-GNN: RAndom Walk Aggregation based Graph Neural Network.,"Di Jin, Rui Wang, Meng Ge, Dongxiao He, Xiang Li, Wei Lin, Weixiong Zhang","Graph-Convolution-based methods have been successfully applied to representation learning on homophily graphs where nodes with the same label or similar attributes tend to connect with one another. Due to the homophily assumption of Graph Convolutional Networks (GCNs) that these methods use, they are not suitable for heterophily graphs where nodes with different labels or dissimilar attributes tend to be adjacent. Several methods have attempted to address this heterophily problem, but they do not change the fundamental aggregation mechanism of GCNs because they rely on summation operators to aggregate information from neighboring nodes, which is implicitly subject to the homophily assumption. Here, we introduce a novel aggregation mechanism and develop a RAndom Walk Aggregation-based Graph Neural Network (called RAW-GNN) method. The proposed approach integrates the random walk strategy with graph neural networks. The new method utilizes breadth-first random walk search to capture homophily information and depth-first search to collect heterophily information. It replaces the conventional neighborhoods with path-based neighborhoods and introduces a new path-based aggregator based on Recurrent Neural Networks. These designs make RAW-GNN suitable for both homophily and heterophily graphs. Extensive experimental results showed that the new method achieved state-of-the-art performance on a variety of homophily and heterophily graphs.",RAW-GNN：基于随机步行聚合的图形神经网络。,基于图形卷积的方法已成功地应用于同质图上的表示学习，其中具有相同标签或相似属性的节点倾向于相互连接。由于这些方法使用的图形卷积网络（GCN）的同义假设，它们不适合异质图，其中具有不同标记或不同属性的节点往往相邻。几种方法试图解决这个异质问题，但是它们没有改变GCN的基本聚合机制，因为它们依靠求和操作员来汇总邻近节点的信息，这隐含地遵守同质假设。在这里，我们介绍了一种新颖的聚合机制，并开发了基于随机步行聚集的图形神经网络（称为RAW-GNN）方法。提出的方法将随机步行策略与图神经网络集成在一起。新方法利用广度优先的随机步行搜索来捕获同质信息和深度优先搜索以收集异性信息。它用基于路径的社区取代了传统社区，并基于经常性神经网络引入了新的基于路径的聚合器。这些设计使RAW-GNN适用于同质图和异质图。广泛的实验结果表明，新方法在各种同质图和异质图上实现了最先进的性能。,https://arxiv.org/abs/2206.13953,IJCAI,True,False,True,False
1697,Enhancing Sequential Recommendation with Graph Contrastive Learning.,"Yixin Zhang, Yong Liu, Yonghui Xu, Hao Xiong, Chenyi Lei, Wei He, Lizhen Cui, Chunyan Miao","The sequential recommendation systems capture users' dynamic behavior patterns to predict their next interaction behaviors. Most existing sequential recommendation methods only exploit the local context information of an individual interaction sequence and learn model parameters solely based on the item prediction loss. Thus, they usually fail to learn appropriate sequence representations. This paper proposes a novel recommendation framework, namely Graph Contrastive Learning for Sequential Recommendation (GCL4SR). Specifically, GCL4SR employs a Weighted Item Transition Graph (WITG), built based on interaction sequences of all users, to provide global context information for each interaction and weaken the noise information in the sequence data. Moreover, GCL4SR uses subgraphs of WITG to augment the representation of each interaction sequence. Two auxiliary learning objectives have also been proposed to maximize the consistency between augmented representations induced by the same interaction sequence on WITG, and minimize the difference between the representations augmented by the global context on WITG and the local representation of the original sequence. Extensive experiments on real-world datasets demonstrate that GCL4SR consistently outperforms state-of-the-art sequential recommendation methods.",通过图形对比度学习增强顺序建议。,顺序推荐系统捕获用户的动态行为模式，以预测其下一个交互行为。大多数现有的顺序推荐方法仅利用单个交互序列的本地上下文信息，并仅根据项目预测损失来学习模型参数。因此，他们通常无法学习适当的顺序表示。本文提出了一个新颖的推荐框架，即顺序推荐的对比度学习（GCL4SR）。具体而言，GCL4SR采用基于所有用户的交互序列构建的加权项目过渡图（WITG），以提供每次交互的全局上下文信息，并削弱序列数据中的噪声信息。此外，GCL4SR使用WITG的子图来增强每个相互作用序列的表示。还提出了两个辅助学习目标，以最大程度地提高由WITG上相同相互作用序列引起的增强表示之间的一致性，并最大程度地减少由全局上下文对WITG和原始序列的局部表示形式增强的差异。对现实世界数据集的广泛实验表明，GCL4SR始终优于最先进的顺序推荐方法。,https://arxiv.org/abs/2205.14837,IJCAI,True,False,False,False
1698,Robust Reinforcement Learning as a Stackelberg Game via Adaptively-Regularized Adversarial Training.,"Peide Huang, Mengdi Xu, Fei Fang, Ding Zhao","Robust Reinforcement Learning (RL) focuses on improving performances under model errors or adversarial attacks, which facilitates the real-life deployment of RL agents. Robust Adversarial Reinforcement Learning (RARL) is one of the most popular frameworks for robust RL. However, most of the existing literature models RARL as a zero-sum simultaneous game with Nash equilibrium as the solution concept, which could overlook the sequential nature of RL deployments, produce overly conservative agents, and induce training instability. In this paper, we introduce a novel hierarchical formulation of robust RL - a general-sum Stackelberg game model called RRL-Stack - to formalize the sequential nature and provide extra flexibility for robust training. We develop the Stackelberg Policy Gradient algorithm to solve RRL-Stack, leveraging the Stackelberg learning dynamics by considering the adversary's response. Our method generates challenging yet solvable adversarial environments which benefit RL agents' robust learning. Our algorithm demonstrates better training stability and robustness against different testing conditions in the single-agent robotics control and multi-agent highway merging tasks.",通过自适应的对抗性训练，强大的强化学习是一款Stackelberg游戏。,强大的强化学习（RL）着重于改善模型错误或对抗性攻击下的性能，这有助于RL代理的现实部署。强大的对抗强化学习（RARL）是RL最受欢迎的框架之一。但是，大多数现有的文献模型都以NASH均衡为解决方案概念的零和同时游戏，可以忽略RL部署的顺序性质，产生过度保守的代理，并引起训练不稳定。在本文中，我们介绍了一种新颖的RL RL的新型分层配方，即一种名为RRL -Stack的通用stackelberg游戏模型 - 以形式化顺序性质，并为健壮的训练提供了额外的灵活性。我们开发了Stackelberg策略梯度算法来解决RRL堆栈，通过考虑对手的反应来利用Stackelberg学习动态。我们的方法产生了有挑战性但可解决的对抗环境，这些环境使RL代理的强大学习受益。我们的算法表明，在单权机器人控制和多机科公路合并任务中，针对不同测试条件的训练稳定性和鲁棒性。,https://arxiv.org/abs/2202.09514,IJCAI,True,False,False,False
1699,CGMN: A Contrastive Graph Matching Network for Self-Supervised Graph Similarity Learning.,"Di Jin, Luzhi Wang, Yizhen Zheng, Xiang Li, Fei Jiang, Wei Lin, Shirui Pan","Graph similarity learning refers to calculating the similarity score between two graphs, which is required in many realistic applications, such as visual tracking, graph classification, and collaborative filtering. As most of the existing graph neural networks yield effective graph representations of a single graph, little effort has been made for jointly learning two graph representations and calculating their similarity score. In addition, existing unsupervised graph similarity learning methods are mainly clustering-based, which ignores the valuable information embodied in graph pairs. To this end, we propose a contrastive graph matching network (CGMN) for self-supervised graph similarity learning in order to calculate the similarity between any two input graph objects. Specifically, we generate two augmented views for each graph in a pair respectively. Then, we employ two strategies, namely cross-view interaction and cross-graph interaction, for effective node representation learning. The former is resorted to strengthen the consistency of node representations in two views. The latter is utilized to identify node differences between different graphs. Finally, we transform node representations into graph-level representations via pooling operations for graph similarity computation. We have evaluated CGMN on eight real-world datasets, and the experiment results show that the proposed new approach is superior to the state-of-the-art methods in graph similarity learning downstream tasks.",CGMN：一种用于自我监督的图形相似性学习的对比图匹配网络。,图形相似性学习是指计算两个图之间的相似性得分，这在许多现实的应用程序（例如视觉跟踪，图形分类和协作过滤）中需要。由于大多数现有的图形神经网络产生了单个图的有效图表，因此几乎没有努力共同学习两个图表并计算其相似性得分。此外，现有的无监督图相似性学习方法主要基于聚类，它忽略了图对中体现的有价值的信息。为此，我们提出了一个对比度图匹配网络（CGMN），以进行自我监督的图形相似性学习，以计算任何两个输入图对象之间的相似性。具体而言，我们分别在一对中为每个图生成两个增强视图。然后，我们采用两种策略，即跨视图相互作用和跨刻画相互作用，以实现有效的节点表示学习。前者求助于两种观点中节点表示的一致性。后者用于识别不同图之间的节点差异。最后，我们通过汇总操作进行图形相似性计算将节点表示形式转换为图形表示。我们已经在八个现实世界数据集上评估了CGMN，实验结果表明，所提出的新方法优于图形相似性学习下游任务的最新方法。,https://arxiv.org/abs/2205.15083,IJCAI,True,False,False,False
1700,Penalized Proximal Policy Optimization for Safe Reinforcement Learning.,"Linrui zhang, Li Shen, Long Yang, Shixiang Chen, Bo Yuan, Xueqian Wang, Dacheng Tao","Safe reinforcement learning aims to learn the optimal policy while satisfying safety constraints, which is essential in real-world applications. However, current algorithms still struggle for efficient policy updates with hard constraint satisfaction. In this paper, we propose Penalized Proximal Policy Optimization (P3O), which solves the cumbersome constrained policy iteration via a single minimization of an equivalent unconstrained problem. Specifically, P3O utilizes a simple-yet-effective penalty function to eliminate cost constraints and removes the trust-region constraint by the clipped surrogate objective. We theoretically prove the exactness of the proposed method with a finite penalty factor and provide a worst-case analysis for approximate error when evaluated on sample trajectories. Moreover, we extend P3O to more challenging multi-constraint and multi-agent scenarios which are less studied in previous work. Extensive experiments show that P3O outperforms state-of-the-art algorithms with respect to both reward improvement and constraint satisfaction on a set of constrained locomotive tasks.",对安全加强学习的惩罚近端政策优化。,安全的强化学习旨在学习最佳政策，同时满足安全限制，这在现实世界中至关重要。但是，当前的算法仍在为有效的政策更新而努力，并具有严格的约束满意度。在本文中，我们提出了受惩罚的近端政策优化（P3O），该政策优化（P3O）通过单一的最小化等效不受约束的问题来解决麻烦的受约束政策迭代。具体而言，P3O利用了简单的罚款功能来消除成本限制，并通过剪裁的替代目标消除了信任区域的约束。从理论上讲，我们用有限的惩罚因素证明了所提出的方法的精确性，并在对样品轨迹进行评估时提供了最坏情况分析，以实现近似误差。此外，我们将P3O扩展到更具挑战性的多构造和多代理方案，这些方案在以前的工作中所研究的情况较少。广泛的实验表明，在一组受限的机车任务上，P3O优于奖励改进和约束满意度的最先进算法。,https://arxiv.org/abs/2205.11814,IJCAI,True,False,False,False
1701,Towards Safe Reinforcement Learning via Constraining Conditional Value-at-Risk.,"Chengyang Ying, Xinning Zhou, Hang Su, Dong Yan, Ning Chen, Jun Zhu","Though deep reinforcement learning (DRL) has obtained substantial success, it may encounter catastrophic failures due to the intrinsic uncertainty of both transition and observation. Most of the existing methods for safe reinforcement learning can only handle transition disturbance or observation disturbance since these two kinds of disturbance affect different parts of the agent; besides, the popular worst-case return may lead to overly pessimistic policies. To address these issues, we first theoretically prove that the performance degradation under transition disturbance and observation disturbance depends on a novel metric of Value Function Range (VFR), which corresponds to the gap in the value function between the best state and the worst state. Based on the analysis, we adopt conditional value-at-risk (CVaR) as an assessment of risk and propose a novel reinforcement learning algorithm of CVaR-Proximal-Policy-Optimization (CPPO) which formalizes the risk-sensitive constrained optimization problem by keeping its CVaR under a given threshold. Experimental results show that CPPO achieves a higher cumulative reward and is more robust against both observation and transition disturbances on a series of continuous control tasks in MuJoCo.",通过限制条件价值的风险进行安全加强学习。,尽管深度强化学习（DRL）取得了巨大的成功，但由于过渡和观察的内在不确定性，它可能遇到灾难性的失败。大多数现有的安全加固学习方法只能处理过渡干扰或观察障碍，因为这两种干扰影响了代理的不同部分。此外，受欢迎的最坏情况可能会导致过度悲观的政策。为了解决这些问题，我们首先从理论上证明了在过渡干扰和观察障碍下的性能降解取决于一个新颖的价值函数范围（VFR），这与最佳状态和最坏状态之间的价值函数的间隙相对应。基于分析，我们采用有条件的价值风险（CVAR）作为对风险的评估，并提出了一种新颖的强化学习算法的CVAR-Proximal-Policy-oftimization（CPPO），该算法通过保持风险敏感的约束优化问题形式化。它的CVAR在给定的阈值下。实验结果表明，CPPO获得了更高的累积奖励，并且在Mujoco中一系列连续控制任务上的观察和过渡干扰更加强大。,https://arxiv.org/abs/2206.04436,IJCAI,True,False,False,False
1702,Language Models as Knowledge Embeddings.,"Xintao Wang, Qianyu He, Jiaqing Liang, Yanghua Xiao","Knowledge embeddings (KE) represent a knowledge graph (KG) by embedding entities and relations into continuous vector spaces. Existing methods are mainly structure-based or description-based. Structure-based methods learn representations that preserve the inherent structure of KGs. They cannot well represent abundant long-tail entities in real-world KGs with limited structural information. Description-based methods leverage textual information and language models. Prior approaches in this direction barely outperform structure-based ones, and suffer from problems like expensive negative sampling and restrictive description demand. In this paper, we propose LMKE, which adopts Language Models to derive Knowledge Embeddings, aiming at both enriching representations of long-tail entities and solving problems of prior description-based methods. We formulate description-based KE learning with a contrastive learning framework to improve efficiency in training and evaluation. Experimental results show that LMKE achieves state-of-the-art performance on KE benchmarks of link prediction and triple classification, especially for long-tail entities.",语言模型作为知识嵌入。,知识嵌入（KE）通过将实体和关系嵌入连续的向量空间来表示知识图（kg）。现有方法主要基于结构或基于描述。基于结构的方法学习保留KGS固有结构的表示。它们不能很好地代表具有有限结构信息的现实世界中的丰富长尾实体。基于描述的方法利用文本信息和语言模型。朝这个方向迈出的先前方法几乎不能胜过基于结构的结构，并且遇到了昂贵的负面抽样和限制性描述需求等问题。在本文中，我们提出了LMKE，该LMKE采用语言模型来得出知识嵌入，旨在既富集了长尾实体的表示形式又旨在解决先前的基于描述的方法的问题。我们通过对比度学习框架制定基于描述的KE学习，以提高培训和评估的效率。实验结果表明，LMKE在链接预测和三重分类的KE基准上实现了最先进的性能，尤其是对于长尾实体。,https://arxiv.org/abs/2206.12617,IJCAI,True,False,True,False
1703,Deep Video Harmonization With Color Mapping Consistency.,"Xinyuan Lu, Shengyuan Huang, Li Niu, Wenyan Cong, Liqing Zhang","Video harmonization aims to adjust the foreground of a composite video to make it compatible with the background. So far, video harmonization has only received limited attention and there is no public dataset for video harmonization. In this work, we construct a new video harmonization dataset HYouTube by adjusting the foreground of real videos to create synthetic composite videos. Moreover, we consider the temporal consistency in video harmonization task. Unlike previous works which establish the spatial correspondence, we design a novel framework based on the assumption of color mapping consistency, which leverages the color mapping of neighboring frames to refine the current frame. Extensive experiments on our HYouTube dataset prove the effectiveness of our proposed framework. Our dataset and code are available at https://github.com/bcmi/Video-Harmonization-Dataset-HYouTube.",深度视频与颜色映射一致性进行协调。,视频协调旨在调整复合视频的前景，以使其与背景兼容。到目前为止，视频协调仅受到有限的关注，并且没有公共数据集用于视频协调。在这项工作中，我们通过调整真实视频的前景以创建合成复合视频来构建一个新的视频协调数据集Hyoutube。此外，我们考虑视频协调任务中的时间一致性。与以前建立空间对应关系的作品不同，我们根据颜色映射一致性的假设设计了一个新颖的框架，该框架利用相邻帧的颜色映射来完善当前帧。在我们的Houtube数据集上进行的大量实验证明了我们提出的框架的有效性。我们的数据集和代码可在https://github.com/bcmi/video-harmonization-dataset-hyoutube上找到。,https://arxiv.org/abs/2205.00687,IJCAI,True,False,False,False
1704,Long-term Spatio-Temporal Forecasting via Dynamic Multiple-Graph Attention.,"Wei Shao, Zhiling Jin, Shuo Wang, Yufan Kang, Xiao Xiao, Hamid Menouar, Zhaofeng Zhang, Junshan Zhang, Flora Salim","Many real-world ubiquitous applications, such as parking recommendations and air pollution monitoring, benefit significantly from accurate long-term spatio-temporal forecasting (LSTF). LSTF makes use of long-term dependency between spatial and temporal domains, contextual information, and inherent pattern in the data. Recent studies have revealed the potential of multi-graph neural networks (MGNNs) to improve prediction performance. However, existing MGNN methods cannot be directly applied to LSTF due to several issues: the low level of generality, insufficient use of contextual information, and the imbalanced graph fusion approach. To address these issues, we construct new graph models to represent the contextual information of each node and the long-term spatio-temporal data dependency structure. To fuse the information across multiple graphs, we propose a new dynamic multi-graph fusion module to characterize the correlations of nodes within a graph and the nodes across graphs via the spatial attention and graph attention mechanisms. Furthermore, we introduce a trainable weight tensor to indicate the importance of each node in different graphs. Extensive experiments on two large-scale datasets demonstrate that our proposed approaches significantly improve the performance of existing graph neural network models in LSTF prediction tasks.",长期时空预测通过动态多圈的注意。,许多现实世界中普遍存在的应用程序，例如停车建议和空气污染监测，都能从准确的长期时空预测（LSTF）中受益匪浅。LSTF利用了空间和时间域，上下文信息和数据中固有模式之间的长期依赖性。最近的研究揭示了多画望神经网络（MGNN）提高预测性能的潜力。但是，由于几个问题，现有的MGNN方法不能直接应用于LSTF：一般性低，不充分使用上下文信息以及不平衡的图形融合方法。为了解决这些问题，我们构建了新的图形模型，以表示每个节点的上下文信息和长期时空数据依赖性结构。为了融合跨多个图形的信息，我们提出了一个新的动态多绘图融合模块，以通过空间注意力和图形注意机制来表征图中节点和跨图的节点的相关性。此外，我们引入了可训练的重量张量，以指示不同图中每个节点的重要性。在两个大规模数据集上进行的广泛实验表明，我们提出的方法显着改善了LSTF预测任务中现有图形神经网络模型的性能。,https://arxiv.org/abs/2204.11008,IJCAI,True,False,False,False
